{
  "id": "issue-003",
  "no": 3,
  "slug": "003-brain-command-center",
  "title": "你的小脑袋里藏着一座宇宙飞船指挥部？",
  "subtitle": "860亿神经元的大脑地图与8种神奇感官探秘",
  "domain": "life",
  "date": "2026-10-18",
  "emoji": "🧠",
  "status": "published",
  "intro": "你的大脑只有一块软软的果冻豆腐那么大，耗电量还不如一盏小夜灯，却指挥着860亿个神经元小宇航员！快来看看飞船舰长、空间雷达、高清显示屏和平衡陀螺仪每天都在忙些什么吧！",
  "knowledgeIds": [
    "cerebral-cortex",
    "frontal-lobe",
    "parietal-lobe",
    "occipital-lobe",
    "temporal-lobe",
    "cerebellum",
    "brainstem",
    "synapse-circuit"
  ],
  "blocks": [
    {
      "id": "hero-1",
      "type": "hero"
    },
    {
      "id": "story-1",
      "type": "story",
      "heading": "一台塞进颅骨里的20瓦超级生物计算机",
      "illustration": "flow",
      "paragraphs": [
        "如果把你的大脑拿出来轻轻放在厨房秤上，它大概只有 **1.4 千克** 重，摸起来就像一块水嫩嫩的豆腐或者果冻。它的功率只有大概 **20 瓦** ——比你家书桌上的护眼台灯还要省电！",
        "但就在这小小的脑袋里，住着 **860 亿个** [[cerebral-cortex|神经元]]（比整个银河系里的星星还要多！），它们之间拉起了超过 **65 万亿条** 通信电话线。折叠在最外面的 [[cerebral-cortex|大脑皮层]] 像一块精密的 6 层微型电路板，如果把它小心展开，足足有一张大号披萨饼那么大。",
        "航天工程师曾经感叹：人类造出最厉害的航天飞机，上面的三轴陀螺仪和超级计算机，其实在你身体里早就有一套更精密、更省电的生物版本！今天，就让我们戴上特制头盔，走进这座神奇的宇宙飞船大脑指挥部！"
      ]
    },
    {
      "id": "qa-1",
      "type": "qa-card",
      "emoji": "🗺️",
      "question": "飞船里有哪些部门？大脑是怎样分工的？",
      "answer": {
        "basic": "大脑像一座井井有条的现代化飞船，主要分为六大部门：\n1. **[[frontal-lobe|额叶（总舰长）]]**：在你的额头后面，负责出谋划策、做决定、克制冲动，指挥嘴巴说话。\n2. **[[parietal-lobe|顶叶（空间雷达）]]**：在头顶偏后，负责感知冷热触痛，随时告诉你小手和小脚在什么位置。\n3. **[[occipital-lobe|枕叶（高清大屏）]]**：在后脑勺，负责把眼睛传来的光线翻译成全彩 3D 动画电影。\n4. **[[temporal-lobe|颞叶（电台与相册）]]**：在两边耳朵旁，听声音、听懂别人说的话，深处的海马体小管家还帮你存记忆。\n5. **[[cerebellum|小脑（自动陀螺仪）]]**：在后脑勺下方，容纳了全脑将近 80% 的神经元，负责骑车、跑跳的平稳平衡与肌肉记忆。\n6. **[[brainstem|脑干（生命发动机）]]**：在最底座，睡觉时也不停息，负责心跳、呼吸和体温稳定。",
        "advanced": "大脑半球解剖以中央沟、外侧裂与顶枕沟划分为四大主要脑叶，辅以小脑与脑干构成中枢神经架构：\n- **[[frontal-lobe|额叶]]**：包含前额叶皮层（PFC，执行功能、工作记忆、冲动抑制）、初级运动皮层（随意运动控制）与布罗卡区（Broca's Area，运动言语编码）。\n- **[[parietal-lobe|顶叶]]**：初级躯体感觉皮层（S1，触觉、温痛觉投射感觉小人）与顶叶联合区（顶内沟 IPS，多感觉空间坐标转换与手眼协调）。\n- **[[occipital-lobe|枕叶]]**：初级视皮层（V1，朝向/空间频率特征抽取）及外纹状皮层（V2~V7），分化为腹侧「识别（What）」流与背侧「空间动作（Where/How）」流。\n- **[[temporal-lobe|颞叶]]**：初级听觉皮层、韦尼克区（Wernicke's Area，语言感知理解）与边缘系统（海马体情景记忆编码、杏仁核情绪警戒）。\n- **[[cerebellum|小脑]]**：约 690 亿致密神经元构成的晶体状环路，通过正向模型比对内耳前庭三轴陀螺仪与肌梭本体反馈，实时纠偏平滑动作。\n- **[[brainstem|脑干]]**：网状激活系统维持觉醒，延髓心血管中枢与呼吸节律中枢（前包钦格复合体）通过迷走神经自主维系生命稳态。"
      }
    },
    {
      "id": "qa-2",
      "type": "qa-card",
      "emoji": "🕸️",
      "question": "一个脑区能独自干完所有活吗？什么是协同网络？",
      "answer": {
        "basic": "绝不能！大脑里的部门从来不是各忙各的孤岛，它们时刻手拉手，组成超级紧密的 **[[synapse-circuit|协同神经网络]]**：\n- 比如你跟好朋友说一句「你好呀」：耳朵先接收声音 ➔ [[temporal-lobe|颞叶]] 听清音节 ➔ 韦尼克区查字典听懂意思 ➔ 信号顺着高速神经公路飞奔到 [[frontal-lobe|额叶]] ➔ 布罗卡区组织好你想回的话 ➔ 运动皮层指挥你的嘴唇、舌头和声带振动发声！\n- 又比如你看到一只可爱的小狗：[[occipital-lobe|枕叶]] 认出小狗的样子 ➔ [[temporal-lobe|海马体]] 翻出以前逗狗的开心回忆 ➔ 杏仁核给心里注入暖暖的喜爱 ➔ [[frontal-lobe|额叶]] 下令慢慢伸出手去轻轻摸它。\n一秒钟都不到的时间里，全脑的很多部门已经开完了一场紧密配合的高层会议！",
        "advanced": "现代认知神经科学已彻底抛弃单一功能区孤立独占的机械局部定位论，确立了**大规模分布式协同网络（Large-Scale Functional Networks）**范式：\n1. **语言协同网络**：外侧裂周围环路，颞上回听觉皮层解码声学信号 ➔ 韦尼克区解析语义 ➔ 经弓状束（Arcuate Fasciculus）高速白质纤维束投射至额下回布罗卡区 ➔ 运动带初级运动皮层驱动发音肌群。\n2. **注意与执行网络**：背外侧前额叶（DLPFC）与后顶叶（IPS）构成额顶控制网络（FPN），执行自上而下的注意定向、冲突解决与工作记忆刷新。\n3. **记忆编码与提取网络**：内侧颞叶海马体进行情景事件快速长时程增强（LTP）编码，夜间经慢波睡眠与额颞新皮层同步振荡，逐步整合固化为长期语义记忆。\n4. **情绪调节网络**：杏仁核侦测威胁与突发刺激，腹内侧前额叶皮层（vmPFC）与前扣带回（ACC）实施自上而下的抑制调节，防止冲动与情绪失控。"
      }
    },
    {
      "id": "qa-3",
      "type": "qa-card",
      "emoji": "👀",
      "question": "除了看、听、闻、尝、摸，我们还有哪3种神奇的隐藏感官？",
      "answer": {
        "basic": "大家都知道五大基本感官：眼睛看、耳朵听、鼻子闻、舌头尝、皮肤摸。但其实你的身体里还藏着 3 种极其厉害的高科技感官通道：\n1. **前庭平衡与加速度觉（耳朵深处的航天陀螺仪）**：内耳半规管里盛着液体和小晶体，哪怕闭上眼睛，电梯上升、汽车刹车、你在转圈，大脑都能清清楚楚知道！\n2. **本体感觉（关节与肌肉的位置探测器）**：骨骼肌和韧带里长满了微型传感器。闭上眼睛，你依然能一口气用食指准确摸到自己的鼻尖，这就是本体感觉在实时汇报双手的位置！\n3. **面部表情直觉读心（微表情反射）**：人类能在一瞬间自动识别对方脸上的喜怒哀乐，并几乎同步做出微妙的镜像表情，这是大脑专门帮我们交朋友、避危险的超能力！",
        "advanced": "人体感官系统远超出经典五感，在神经工程与航天生物学中尤为重视以下三类多模态深层感受通道：\n1. **前庭平衡与三轴惯性感知（Vestibular System）**：内耳椭圆囊、球囊（感知直线加速度与重力矢量）与三个互相垂直的半规管（感知三维旋转角速度），其壶腹嵴毛细胞剪切偏折将机械变形转化为神经冲动，经前庭前庭神经核直达 [[cerebellum|小脑]] 形成前庭-眼动反射（VOR，确保剧烈奔跑时视网膜图像像稳定云台一样稳定）。\n2. **本体感觉（Proprioception）**：分布于肌肉内的肌梭（检测肌纤维牵拉长度与速率）和肌腱处的腱器官（高尔基腱器官，检测肌张力），经脊髓后索-内侧丘系通路将肢体动态空间构型持续回传至初级躯体感觉皮层与顶叶 IPS。\n3. **面部表情编码与镜像神经元系统（Facial & Mirror Systems）**：梭状回面孔区（FFA）解析面部拓扑特征，上颞沟（STS）解析动态表情注视方向，杏仁核与前额叶镜像神经元系统（MNS）自动诱发动作模拟与共情，实现毫秒级社交线索解码。"
      }
    },
    {
      "id": "demo-1",
      "type": "demo",
      "demo": "brain-explorer",
      "title": "飞船中控台：大脑功能分区与协同网络探秘",
      "instruction": "点击大脑各个分区点亮飞船部门，或者启动底部的【协同网络模式】，观察一句话、一个动作如何在脑海中如光流般流转！"
    },
    {
      "id": "match-1",
      "type": "match",
      "title": "飞船部门大连线：找出脑区的小伙伴",
      "instruction": "根据大脑分工，把左边的脑区与右边最恰当的飞船角色连起来吧！",
      "pairs": [
        {
          "left": "额叶 (Frontal Lobe)",
          "right": "飞船总舰长：做计划与下命令",
          "emoji": "👑"
        },
        {
          "left": "枕叶 (Occipital Lobe)",
          "right": "超高清显示屏：看懂颜色与动态",
          "emoji": "🖥️"
        },
        {
          "left": "小脑 (Cerebellum)",
          "right": "自动平衡陀螺仪：调控平稳动作",
          "emoji": "🎪"
        },
        {
          "left": "脑干 (Brainstem)",
          "right": "生命发动机底座：管呼吸与心跳",
          "emoji": "⚡"
        }
      ]
    },
    {
      "id": "sort-1",
      "type": "sort",
      "title": "信息大旅行：听到叫你名字并转头回答的顺序",
      "instruction": "当妈妈在背后喊你名字时，神经信号在大脑里经历了怎样的旅程？按时间先后排排序：",
      "goal": "从听到声音到开口转头回答的正确顺序",
      "items": [
        "1. 耳朵鼓膜振动，将声音转为电信号沿听神经传向大脑",
        "2. 颞叶初级听觉皮层接收声音，韦尼克区听出这是「妈妈在喊我」",
        "3. 信号经高速纤维传到额叶布罗卡区与运动皮层，组织好想说的「哎，我在呢！」",
        "4. 顶叶与枕叶协同计算妈妈声音传来的方位，指挥颈部肌肉转身，面部肌肉微笑回答"
      ]
    },
    {
      "id": "exp-1",
      "type": "experiment",
      "title": "家庭神经小侦探：闭眼金鸡独立与视野盲点大探秘",
      "emoji": "🔬",
      "time": "15 分钟",
      "adultHelp": "低难度安全实验，建议家长在身旁计时并防止孩子单脚站立晃动时摔倒。",
      "materials": [
        "一把 30 厘米的普通塑料直尺",
        "一张白纸和黑色记号笔（画十字与黑点）",
        "手机秒表计时器",
        "宽敞平整的地面（脱鞋站立）"
      ],
      "steps": [
        "实验一【平衡陀螺仪挑战略】：双脚并拢站直，抬起一只脚金鸡独立，睁着眼睛记录你能坚持多少秒；稍作休息后，闭上双眼，再次尝试同一只脚金鸡独立，记录秒数。",
        "实验二【寻找隐形物理盲点】：在白纸左边画一个黑色实心「+」字，右边相距 8 厘米处画一个黄豆大小的黑色实心圆点「●」。左手遮住左眼，用右眼紧紧盯着左边的「+」字，慢慢将纸张从眼前 30 厘米处向前或向后平移。",
        "实验三【神经反应速度大比拼】：家长拿着 30cm 尺子顶端垂直悬空，孩子的虎口张开放在尺子底部刻度 0 处待命（不碰到尺子）。家长随时无声松手，孩子以最快速度抓捏尺子，看捏在多少厘米处！"
      ],
      "safety": [
        "做闭眼单脚站立实验时，请避开尖锐桌角，若身体倾斜请随时放下另一只脚以防跌倒。",
        "使用直尺测试反应时间时注意手部安全，避免被硬塑料尺边缘刮蹭手指。"
      ],
      "observe": [
        "你会发现：闭上眼睛后，身体摇晃得剧烈多了，坚持时间往往大幅缩水！这是因为平时小脑依靠【眼睛视觉 + 内耳前庭 + 脚底本体感觉】三巨头协同；一旦闭眼砍掉视觉通道，小脑就只能全凭前庭和脚底肌肉微调，难度暴增！",
        "移动白纸到约 15~20 厘米时，你会神奇地发现右边的黑点「凭空消失了」！因为该物像刚好投射在视神经穿出视网膜的盲点（Optic Disc，此处没有感光细胞），而大脑皮层会自动用周围白纸的颜色把它「脑补」抹平！",
        "根据自由落体公式 t = √(2h/g)，捏住尺子在 10cm 处说明反应时间约 0.14 秒；在 20cm 处约为 0.20 秒。神经冲动从眼睛看 ➔ 枕叶 ➔ 额叶 ➔ 脊髓 ➔ 手指肌肉，光速般的电化接力就发生在这短短百分之十几秒内！"
      ]
    },
    {
      "id": "quiz-1",
      "type": "quiz",
      "questions": [
        {
          "id": "q1",
          "level": "basic",
          "question": "骑自行车、学滑板或者弹琴练熟后的「肌肉记忆」，主要由哪个脑区当好帮手？",
          "options": [
            "A. 胃部神经",
            "B. 小脑 (Cerebellum)",
            "C. 枕叶 (Occipital Lobe)",
            "D. 眉毛下面的皮肤"
          ],
          "answer": 1,
          "explain": {
            "basic": "小脑是身体不知疲倦的杂技师和平衡陀螺仪！熟练的动作（如骑车、滑冰）会被它记录成自动化程序，让你不用分心也能稳稳滑行。",
            "advanced": "小脑具备约 690 亿高度密集神经元，通过普肯野细胞进行运动误差前馈修正与程序性动作记忆巩固。"
          }
        },
        {
          "id": "q2",
          "level": "basic",
          "question": "人类虽然双眼长在脸前面，但真正负责看懂图像的「枕叶」长在脑袋的哪里？",
          "options": [
            "A. 脑门正前方",
            "B. 嘴巴下巴底下",
            "C. 后脑勺偏下方",
            "D. 两只耳朵内部"
          ],
          "answer": 2,
          "explain": {
            "basic": "枕叶长在后脑勺！眼睛像摄像机镜头抓取光线，然后通过长长的视神经一路传到后脑勺的枕叶，在那里合成高清电影画面。",
            "advanced": "初级视觉皮层（V1/Brodmann 17区）位于枕叶距状沟两侧，按视网膜拓扑映射接收外侧膝状体（LGN）传来的视觉传导信号。"
          }
        },
        {
          "id": "q3",
          "level": "advanced",
          "question": "如果一个人听得懂别人说话，但自己说话时非常费劲、词不成句，最可能是哪个语言脑区受到了损伤？",
          "options": [
            "A. 额叶的布罗卡区 (Broca's Area)",
            "B. 颞叶的韦尼克区 (Wernicke's Area)",
            "C. 脑干延髓",
            "D. 内耳前庭器官"
          ],
          "answer": 0,
          "explain": {
            "basic": "布罗卡区长在额叶，是专门负责指挥说话肌肉的「语言工厂组织者」；如果它受损，虽然心里完全明白别人的意思，但嘴巴就是结结巴巴说不出来。",
            "advanced": "这是典型的运动性失语症（Broca's Aphasia，表达性失语），额下回后部的布罗卡区受损导致言语生成障碍，但言语理解功能（韦尼克区）通常完好。"
          }
        }
      ]
    },
    {
      "id": "open-q-1",
      "type": "open-question",
      "heading": "未来小创想：脑机接口与超能力脑电波",
      "text": "如果未来的科学家发明了一种超级安全的小发卡或者微型脑机接口，可以把大脑和电脑无缝连在一起，你最想给自己的大脑增加一个什么酷炫的超能力？你想用它来做些什么有趣的事情呢？",
      "suggestions": [
        "直接下载全世界的外语，和来自每一个国家的小伙伴毫无障碍聊天！",
        "像录像机一样回放昨晚做过的奇幻梦境，做成一部动画大片！",
        "用脑电波直接指挥遥控小车或者机械手臂，帮妈妈把地上的玩具收纳整齐！"
      ]
    },
    {
      "id": "vocab-1",
      "type": "vocab",
      "ids": [
        "cerebral-cortex",
        "frontal-lobe",
        "parietal-lobe",
        "occipital-lobe",
        "temporal-lobe",
        "cerebellum",
        "brainstem",
        "synapse-circuit"
      ]
    }
  ]
}
